{
  "$schema": "./metroidvania_graph.schema.json",
  "meta": {
    "name": "Maggy Metroidvania Prototype",
    "package": "Maggy/GeneratedProto",
    "room_prefix": "mv_",
    "tile_width": 16,
    "tile_height": 8,
    "room_style": "wind",
    "layout_mode": "zones-first",
    "auto_connect_adjacent": true,
    "seed": 42
  },
  "abilities": [
    {
      "id": "dash",
      "label": "Dash",
      "kind": "movement",
      "starts_unlocked": true
    },
    {
      "id": "climb",
      "label": "Climb",
      "kind": "movement",
      "starts_unlocked": true
    },
    {
      "id": "double_jump",
      "label": "Feather Boots",
      "kind": "movement"
    },
    {
      "id": "red_key_access",
      "label": "Crimson Seal",
      "kind": "key"
    }
  ],
  "items": [
    {
      "id": "boots_upgrade",
      "label": "Feather Boots",
      "grants_abilities": ["double_jump"]
    },
    {
      "id": "crimson_seal",
      "label": "Crimson Seal",
      "grants_abilities": ["red_key_access"],
      "sets_flags": ["red_door_openable"]
    }
  ],
  "locks": [
    {
      "id": "red_gate",
      "label": "Crimson Barrier",
      "requires": {
        "ability": "red_key_access"
      },
      "sets_flags_on_open": ["red_gate_open"]
    },
    {
      "id": "summit_gap",
      "label": "Large Summit Gap",
      "requires": {
        "all": [
          { "ability": "dash" },
          { "ability": "double_jump" }
        ]
      }
    }
  ],
  "zones": [
    {
      "id": "village",
      "label": "Village Approach",
      "tags": ["safe", "hub"],
      "style": "normal",
      "min_rooms": 2,
      "max_rooms": 4,
      "preferred_neighbors": ["cliffs"]
    },
    {
      "id": "cliffs",
      "label": "Frozen Cliffs",
      "tags": ["wind", "movement"],
      "style": "wind",
      "min_rooms": 3,
      "max_rooms": 6,
      "preferred_neighbors": ["village", "sanctum"]
    },
    {
      "id": "sanctum",
      "label": "Sky Sanctum",
      "tags": ["late", "boss"],
      "style": "summit",
      "min_rooms": 2,
      "max_rooms": 4,
      "preferred_neighbors": ["cliffs"],
      "entry_requirements": [
        { "ability": "double_jump" }
      ]
    }
  ],
  "room_templates": [
    {
      "id": "village_entry",
      "zone": "village",
      "weight": 2.0,
      "difficulty": 1,
      "tags": ["intro", "hub", "rest"],
      "layout": "3333333333333333\n3              3\n3              3\n3              3\n3      Q       3\n3              3\n3P             3\n3333333333333333",
      "supports_beats": ["start", "checkpoint"],
      "exits": [
        { "id": "east", "side": "right", "connects_to_tags": ["movement", "hub"] }
      ],
      "reward_slots": [
        { "id": "campfire_checkpoint", "kind": "checkpoint", "anchor": { "x": 48, "y": 40 } }
      ]
    },
    {
      "id": "cliff_boots_branch",
      "zone": "cliffs",
      "weight": 1.6,
      "difficulty": 3,
      "tags": ["movement", "ability", "branch"],
      "layout": "3333333333333333\n3     3        3\n3     3      Q 3\n3  3333         \n3            333\n3              3\n3              3\n3333333333333333",
      "supports_beats": ["ability"],
      "exits": [
        { "id": "west", "side": "left", "connects_to_tags": ["hub"] },
        { "id": "east", "side": "right", "connects_to_tags": ["late", "checkpoint"] }
      ],
      "reward_slots": [
        {
          "id": "boots_pickup",
          "kind": "item",
          "allowed_items": ["boots_upgrade"],
          "anchor": { "x": 88, "y": 24 }
        }
      ]
    },
    {
      "id": "cliff_red_gate",
      "zone": "cliffs",
      "weight": 1.1,
      "difficulty": 4,
      "tags": ["movement", "lock", "gate"],
      "layout": "3333333333333333\n3      X       3\n3   X      X    \n3        33     \n3 X             3\n3       Q       3\n3              3\n3333333333333333",
      "supports_beats": ["lock", "shortcut"],
      "exits": [
        { "id": "west", "side": "left", "connects_to_tags": ["hub", "movement"] },
        {
          "id": "east_locked",
          "side": "right",
          "lock_id": "red_gate",
          "connects_to_tags": ["late", "boss"]
        }
      ]
    },
    {
      "id": "sanctum_checkpoint",
      "zone": "sanctum",
      "weight": 1.3,
      "difficulty": 5,
      "tags": ["checkpoint", "late", "rest"],
      "layout": "3333333333333333\n3              3\n3      C       3\n3              3\n3      Q       3\n3              3\n3              3\n3333333333333333",
      "supports_beats": ["checkpoint"],
      "exits": [
        { "id": "west", "side": "left", "connects_to_tags": ["movement", "gate"] },
        {
          "id": "east",
          "side": "right",
          "requires": [
            {
              "all": [
                { "ability": "dash" },
                { "ability": "double_jump" }
              ]
            }
          ],
          "connects_to_tags": ["boss", "goal"]
        }
      ]
    },
    {
      "id": "sanctum_boss_goal",
      "zone": "sanctum",
      "weight": 1.0,
      "difficulty": 6,
      "tags": ["boss", "goal", "late"],
      "layout": "3333333333333333\n3    X      X  3\n3 3333   3333  3\n3              3\n3      Q       3\n3  X       X   3\n3             C3\n3333333333333333",
      "supports_beats": ["boss", "goal"],
      "exits": [
        { "id": "west", "side": "left", "connects_to_tags": ["checkpoint"] }
      ],
      "reward_slots": [
        { "id": "boss_reward", "kind": "story", "anchor": { "x": 104, "y": 40 } }
      ]
    }
  ],
  "graph": {
    "start": "start_village",
    "goal": "goal_sanctum",
    "room_budget": {
      "min": 8,
      "target": 11,
      "max": 14
    },
    "critical_path_length": {
      "min": 5,
      "target": 7,
      "max": 9
    },
    "branch_budget": {
      "side_paths": 2,
      "optional_reward_rooms": 2,
      "shortcuts": 1,
      "loops": 1
    },
    "zone_order": [
      { "id": "village", "weight": 2.0 },
      { "id": "cliffs", "weight": 3.0 },
      { "id": "sanctum", "weight": 1.5 }
    ],
    "beats": [
      {
        "id": "start_village",
        "kind": "start",
        "zone": "village",
        "allowed_room_tags": ["intro", "hub"],
        "preferred_templates": ["village_entry"]
      },
      {
        "id": "boots_pickup",
        "kind": "ability",
        "zone": "cliffs",
        "grants_item": "boots_upgrade",
        "allowed_room_tags": ["ability", "branch"],
        "preferred_templates": ["cliff_boots_branch"]
      },
      {
        "id": "red_gate_unlock",
        "kind": "lock",
        "zone": "cliffs",
        "requires": [
          { "ability": "double_jump" }
        ],
        "grants_item": "crimson_seal",
        "opens_lock": "red_gate",
        "allowed_room_tags": ["gate", "lock"],
        "preferred_templates": ["cliff_red_gate"]
      },
      {
        "id": "sanctum_save",
        "kind": "checkpoint",
        "zone": "sanctum",
        "requires": [
          { "flag": "red_gate_open" }
        ],
        "allowed_room_tags": ["checkpoint", "late"],
        "preferred_templates": ["sanctum_checkpoint"]
      },
      {
        "id": "goal_sanctum",
        "kind": "goal",
        "zone": "sanctum",
        "requires": [
          {
            "all": [
              { "flag": "red_gate_open" },
              { "ability": "double_jump" }
            ]
          }
        ],
        "allowed_room_tags": ["boss", "goal"],
        "preferred_templates": ["sanctum_boss_goal"]
      }
    ],
    "allow_backtracking": true,
    "allow_softlocks": false,
    "prefer_revisitable_hubs": true,
    "hub_room_tags": ["hub", "checkpoint"]
  },
  "placement_rules": {
    "required_tags": ["checkpoint", "boss"],
    "min_tag_counts": {
      "movement": 2,
      "late": 2
    },
    "excluded_adjacent_tag_pairs": [
      ["rest", "rest"],
      ["boss", "boss"]
    ],
    "late_game_tags": ["late", "boss", "goal"],
    "late_game_start_ratio": 0.65,
    "max_hazard_density": 0.18,
    "forbid_duplicate_templates_within": 2,
    "prefer_zone_locality": 1.5
  },
  "validation": {
    "simulate_progression": true,
    "require_goal_reachable": true,
    "require_all_critical_beats_reachable": true,
    "forbid_unreachable_rewards": false,
    "forbid_ability_deadlocks": true,
    "forbid_consumable_lock_exhaustion": true,
    "emit_solver_trace": true
  },
  "render_defaults": {
    "stylegrounds": {
      "backgrounds": [
        {
          "name": "parallax",
          "texture": "bgs/04/bg0",
          "blendMode": "alphablend",
          "loopX": true,
          "loopY": true,
          "scrollX": 0.25,
          "scrollY": 0.05,
          "x": 0,
          "y": 0,
          "color": "ffffff",
          "alpha": 1.0,
          "flipX": false,
          "flipY": false,
          "instantIn": false,
          "instantOut": false
        }
      ],
      "foregrounds": [
        {
          "name": "Wind"
        }
      ]
    },
    "room_flags": {
      "windPattern": "Left"
    }
  }
}